[
  {
    "name": "alice",
    "email": "alice@example.com",
    "avatar": "https://loremflickr.com/200/200",
    "certificationLink": "https://www.credly.com/organizations/devstream/badge",
    "badge": {
      "type": "Evangelist",
      "achievement": "Associate"
    },
    "dateAdded": "2022/03/01"
  },
  {
    "name": "bob",
    "email": "bob@example.com",
    "avatar": "https://loremflickr.com/200/200",
    "certificationLink": "https://www.credly.com/organizations/devstream/badge",
    "badge": {
      "type": "Open-Source Contributor",
      "achievement": "Associate"
    },
    "dateAdded": "2022/03/01"
  },
  {
    "name": "cindy",
    "email": "cindy@example.com",
    "avatar": "https://loremflickr.com/200/200",
    "certificationLink": "https://www.credly.com/organizations/devstream/badge",
    "badge": {
      "type": "Evangelist",
      "achievement": "Associate"
    },
    "dateAdded": "2022/03/01"
  },
  {
    "name": "Dave",
    "email": "dave@example.com",
    "avatar": "https://loremflickr.com/200/200",
    "certificationLink": "https://www.credly.com/organizations/devstream/badge",
    "badge": {
      "type": "Evangelist",
      "achievement": "Associate"
    },
    "dateAdded": "2022/03/01"
  },
  {
    "name": "Elf",
    "email": "elf@example.com",
    "avatar": "https://loremflickr.com/200/200",
    "certificationLink": "https://www.credly.com/organizations/devstream/badge",
    "badge": {
      "type": "Evangelist",
      "achievement": "Associate"
    },
    "dateAdded": "2022/03/01"
  },
  {
    "name": "Frank",
    "email": "frank@example.com",
    "avatar": "https://loremflickr.com/200/200",
    "certificationLink": "https://www.credly.com/organizations/devstream/badge",
    "badge": {
      "type": "Evangelist",
      "achievement": "Associate"
    },
    "dateAdded": "2022/03/01"
  },
  {
    "name": "Gerald",
    "email": "gerald@example.com",
    "avatar": "https://loremflickr.com/200/200",
    "certificationLink": "https://www.credly.com/organizations/devstream/badge",
    "badge": {
      "type": "Open-Source Contributor",
      "achievement": "Associate"
    },
    "dateAdded": "2022/03/01"
  }
]
